0,1,2,3,4,5,6,7
佐藤クリニック,526-0033,滋賀県長浜市平方町1240番地,0749-65-0100,http://www.sato-clinic.com,有,"・月・火・木・金:9:00~12:30,16:00~19:30・土:9:00~12:30",有 ノルレボ錠1.5mg
基本情報,,,,,,,
施設名,郵便番号,住所,電話番号,ウェブサイトURL,産科、婦人科又は産婦人科の標榜の有無,医療機関における緊急避妊への対応可能時間帯,常時の緊急避妊薬の在庫の有無
独立行政法人 市立大津市民病院,520-0804,滋賀県大津市本宮2丁目9-9,077-521-5414,https://www.och.or.jp/,有,月~木 9:00~15:30上記以外は救急にて対応可,無
青木レディース・クリニック,520-0241,滋賀県大津市今堅田2丁目26-5,077-573-5215,http://aoki-ladies.jp/s/,有,・月曜日~土曜日:9:00~12:00(祝日を除く)・月・水・金:17:00~19:00,有(レボノルゲストル錠1.5mg(1日1名分のみ)プラノバール錠)
医療法人 せせらき会浮田クリニック,520-0242,滋賀県大津市本堅田六丁目36番1号,077-574-3751,https://ukita.gh.jp/,有,・月・水・金:9:00~12:3016:30~19:00・火・木・土:9:00~12:30,有(ノルレボ錠1.5mg)
青地うえだクリニック,520-0043,滋賀県大津市中央1-1-6,077-522-3940,https://www.aoueda-cl.com,有,・月~金:9:00~12:00・月・水・金:17:00~19:00・土曜9:00~12:00(第1-3・5のみ),有 レボノルゲストレル錠1.5mg「F」プラノバール ヤッペ法のみ取り扱い。在庫あり。
医療法人桂川レディースクリニック,520-0834,滋賀県大津市御殿浜21-8,077-511-4135,http://www.katsuragawa-lc.com,有,・月・水・金 9:00~12:30/16:00~19:00・火・木 9:00~12:30/16:00~17:30・土 9:00~12:30,有(レボノルゲストレル錠1.5mg「F」)
医療法人 竹林ウイメンズクリニック,520-2144,滋賀県大津市大萱1丁目1番1号,077-547-3557,https://www.takebayashi-clinic.com,有,24時間対応,有(Levonorgestrol LP1.5mg)
中井医院,520-0524,滋賀県大津市和邇今宿572-4,077-594-0010,未記載,有,・月・火・水・金:9:00~11:3013:30~16:00・木・土:9:00~11:30,有 レボノルゲストレル錠F」
中井医院,520-0524,滋賀県大津市和邇今宿572-4,077-594-0010,未記載,有,・月・火・水・金:8:30~11:3013:30~16:00・木・土:8:30~11:30,有
医療法人若葉会 松島産婦人科医院,520-0027,滋賀県大津市錦織3丁目6-22,077-525-0025,http://matsushima.ladies.jp,有,・月・水・金:9:00~19:30・火・木・土:9:00~15:00,有 レボノルゲストレル錠1.5mg「F」プラノバール ヤッペ法
たかこレディスクリニック,520-0832,滋賀県大津市粟津町3-2-303,077-534-4031,http://www.medic-grp.co.jp/dr/takako-lc,有,"・月・水・金:8:45~12:00,16:45~19:00・火・土:8:45~12:00",有 レボノルゲストレル錠1.5mg「F」プラノバール ヤッペ法相談により可
社会福祉法人恩賜財団済生会滋賀県病院,520-3046,滋賀県栗東市大橋2丁目4番1号,077-552-1221,https://www.saiseikai-shiga.jp,有,平日 8:30-17:00,有(ノルレボー錠1.5mg)
南草津野村病院,525-0059,滋賀県草津市野路1丁目6-5,077-561-3788,http://www.nomura-magokoro-med.or.jp/,有,・平日:9:00~12:00・月・水・金:17:00~19:00・土曜:9:00~12:00,有 レボノルゲストレル錠F」
医療法人産婦人科ハピネスバースクリニック,525-0066,滋賀県草津市矢橋町233-3,077-564-3101,http://happiness-bc.com,有,・日~土:9:00~12:00・月・火・水・金:17:00~19:30,有 ノルレボ錠1.5mgレボノルゲストレル錠1.5mg「F」プラノバール ヤッペ法
ちばレディースクリニック,520-3024,滋賀県栗東市小柿5丁目13-2,077-551-5383,http://www.chiba-lc.com/,有,"・月・火・木:9:30~12:30,17:30~19:30・水・金・土・日(祝日含む):9:30~12:30",有 レボノルゲストレル錠1.5mg「F」プラノバール
医療法人智林会 山田産婦人科,525-0025,滋賀県草津市西渋川1丁目21-14,077-562-1175,http://www.yamadaclinic.com/,有,・月・火・水・金・土:9:00~12:00・月・水・金:17:00~19:00,有 レボノルゲストレル錠1.5mg「F」プラノバール
はなだ婦人クリニック,520-3031,滋賀県栗東市綣3-10-22,077-551-2175,http://hanada-f-clinic.com/,有,"・平日(除木曜):9:30-12:30,17:30~19:30・土曜:9:30~12:30",有 レボノルゲストレル錠1.5mg「F」プラノバール
医療法人社団渡辺産婦人科,520-3027,滋賀県栗東市野尻435,077-551-1331,http://www.wananabe-cl.or.jp,有,・平日:9:15~13:00・月・水・金:17:00~19:30・土曜:9:15~13:00,無(処方箋)
市立野洲病院,520-2331,滋賀県野洲市小篠原1094,077-587-1332,https://www.yasu-hp.jp,有,平日 9:00-11:30,有 レボノルゲストレル錠F(1錠のみ)プラノバール
坂井産婦人科,524-0044,滋賀県守山市古高町383,077-581-0565,https://sakai-clinic.com/,有,・平日:9:00~12:00・月・水・金:17:30~19:30・土曜:9:00~12:00,有 レボノルゲストレル錠1.5mg「F」プラノバール
公立甲賀病院,528-0014,滋賀県甲賀市水口町松尾1256番地,0748-62-0234,https://www.kohka-hp.or.jp/,有,・平日 8:45~12:00・土日祝 9:00~17:00(救急外来にて対応),有 ノルレボ錠1.5mg(2人分のみ)
医療法人みのり会濱田クリニック,528-0005,滋賀県甲賀市水口町水口5992-1,0748-65-3737,http://shiga-hamada-clinic.jp,有,・月・水・金:9:00~20:00・火・木:9:00~13:00・土曜:9:00~13:00,有 ノルレボ錠1.5mgプラノバール ヤッペ法)
医療法人親愛レディースクリニック,528-0041,滋賀県甲賀市水口町虫生野1098-1,0748-63-3321,http://www.shinai-lc.jp/,有,・月~土 9:00~12:00・月・火・水・金 16:30~19:30,有 レボノルゲストレル錠1.5mg「F」プラノバール
医療法人真心会野村産婦人科,520-3233,滋賀県湖南市柑子袋611,0748-72-6633,http://www.nomura-magokoro-med.or.jp/,有,・平日:9:00~19:00・土曜:9:00~12:30,有 レボノルゲストレル錠1.5mg「F」
太田産婦人科医院,523-0898,滋賀県近江八幡市鷹飼町南3丁目3-5,0748-38-0341,http://www.ohta-lc.com/,有,"・月・水・金:9:00~11:30,16:30~18:30・火・木・土:9:00~11:30",有 プラノバール等のヤッペ法
独立行政法人国立病院東近江総合医療センター,527-8505,滋賀県東近江市五智町255,0748-22-3030,https://higashiomi.hosp.go.jp/,有,・平日 8:30~16:30・夜間・土・日・祝日:当直医にて対応,有 ノルレボ錠1.5mg 1錠(1日1名分)
笠原レディースクリニック,527-0091,滋賀県東近江市小脇町2401番地6,0748-22-2101,http://www.kasahara-ladies.com,有,・月火水金土 8:30~12:30・月水土 17:00~18:30,無 プラノバール ヤッペ法
医療法人社団山崎クリニック,521-1225,滋賀県東近江市山路町2907,0748-42-1135,無,有,・月~土曜:9:00~12:00・月・火・水・金:15:30~18:00,有 ノルレボ錠1.5mg
医療法人社団常伯会寺井産婦人科院,521-1222,滋賀県東近江市佐野町670,0748-42-0036,,有,・月・火・水・金・土:8:00~12:00・月・金:16:30~19:00,有
医療法人青葉会神野レディースクリニック アリス,522-0057,滋賀県彦根市八坂町2888-1,0749-29-9025,http://www.jinno-lc.com,有,・月~土:9:00~12:00・月・火・木・金:16:00~19:00,有 レボノルゲストレル錠1.5mg「F」
医療法人青葉会神野レディスクリニック ソフィア,522-0223,滋賀県彦根市川瀬馬場町1082-1,0749-25-5566,http://www.jinno-lc.com,有,"・月・金:9:00~12:00, 16:00~19:00・火・水・土:9:00~12:00",有 レボノルゲストレル錠1.5mg「F」プラノバール ヤッペ法
医療法人成宮クリニック,529-1313,滋賀県愛知郡愛荘町市917-7,0749-42-2620,https://www.narumiya-clinic.or.jp/,有,・平日:8:45~19:00・土曜:8:45~12:30,有 レボノルゲストレル錠1.5mg「F」プラノバール ヤッペ法)
はやし婦人クリニック,522-0044,滋賀県彦根市竹ヶ鼻658,0749-26-0528,https://www.hayashi-womens-clinic.com,有,"・月・火・木・金:9:00~12:00,16:00~19:00・水・土:9:00~12:00",有
医療法人青葉会神野レディスクリニック,522-0063,滋賀県彦根市中央町3-73,0749-22-6216,http://www.jinno-lc.com,有,"・平日:9:00~12:00, 15:00~19:00・土曜:9:00~12:00",有 レボノルゲストレル錠F」プラノバール
市立長浜病院,526-8580,滋賀県長浜市大戌亥町313番地,0749-68-2300,http://www.nagahama-hp.jp,有,・平日:9:00~17:00・土・日・祝日 9:00~17:00,有 レボノルゲストレル錠1.5mg「F」
