0,1,2,3,4,5,6,7
医療法人 糸氏医院,559-0016,大阪市住之江区西加賀屋1丁目1番6号,06-6681-2772,―,婦人科 有,平日9:00-12:30 17:00-19:30木土9:00-12:30,有
なかむらレディースクリニック,559-0005,大阪市住之江区西住之江1丁目1番31号N.KLASS住ノ江1階,06-6675-1211,http://www.web-know.com/nlc/,産婦人科 有,月火水金土9:00-12:00月火水金16:30-19:00,無
大阪市立住之江診療所,559-0012,大阪市住之江区東加賀屋1丁目2番22号,06-6681-1000,―,有,月水金9:00-11:00,無
あさだクリニック,559-0012,大阪市住之江区東加賀屋3丁目4番7号,06-6684-2212,http://www.asadaclinic.jp/,有,診療時間内,有
沢井産婦人科医院,558-0032,大阪市住吉区遠里小野3丁目4番8号,06-6694-1115,http://www.sawai-lc.com/,有,月・水 9:00-12:00 16:30-19:30火・金 9:00-12:00 15:00-18:00土 9:00-12:00,有
基本情報,,,,,,,
施設名,郵便番号,住所,電話番号,ウェブサイトURL,産科、婦人科又は産婦人科の標榜の有無,医療機関における緊急避妊にかかる対面診療への対応可能時間帯,常時の緊急避妊薬の在庫の有無
たつたレディースクリニック,558-0011,大阪市住吉区苅田5丁目19番19号あびこ駅前クリニックモール3階,06-6696-6080,https://www.tatsuta-lc.com/,有,平日9:00-19:00土9:00-12:00,有
ふくだレディースクリニック,558-0001,大阪市住吉区大領5丁目4番23号グレース住吉101号,06-6699-1239,https://fukuda-l.com,有,月~土8:00-12:00月金16:00-19:00火木土13:30-16:00,有
医療法人 瓢成会 なかがわレディースクリニック,558-0044,大阪市住吉区長峡町5番5号,06-6671-0158,http://www.nakagawa-iin.net/,有,平日9:00-12:30 17:00-19:00土9:00-12:30木・日・祝休診,有
井口医院,546-0044,大阪市東住吉区北田辺6丁目13番8号,06-6628-6131,http://iguchi-clinic1967.com/,有,月~土9:30-12:00月水金17:00-19:00,有
髙畑産婦人科,546-0043,大阪市東住吉区駒川1丁目7番3号,06-6719-0185,http://www.kouhata.net/,有,平日9:00-19:30土9:00-13:00,有
医療法人ゆたかマタニティ超音波クリニック,547-0024,大阪市平野区瓜破1丁目6番6号グランドール南平野1階,06-6704-1103,―,有,平日土日9:00-18:30月(祝)9:00-12:30,有
高木レディースクリニック,547-0002,大阪市平野区加美東1丁目13番44号O.T.Mビル3階,06-4303-6222,http://www.takagi-lc.com/,有,月・火・金 9:00-12:0016:00-19:00木土9:00-12:00水 休診,有
元林産婦人科内科,547-0011,大阪市平野区長吉出戸8丁目7番27号,06-6707-0010,http://motobayashi-sanfujinka.com/,有,平日9:00-12:00 17:30-20:00土9:00-13:00,有
日野レディースクリニック,547-0016,大阪市平野区長吉長原3丁目16番6号,06-6706-1600,―,有,平日9:30-13:00 17:00-20:00土9:30-13:00,有
医療法人 佐々木産婦人科医院,547-0012,大阪市平野区長吉六反3丁目21番13号,06-6790-1320,―,有,平日8:30-12:00 16:30-19:00土8:30-12:00,有
医療法人 植田産婦人科,547-0046,大阪市平野区平野宮町2丁目8番8号,06-6791-1726,http://www.ueda-ladiesclinic.com/,有,24時間対応(ただし事前連絡必要),有
猪木産婦人科,557-0032,大阪市西成区旭1丁目1番3号,06-6641-0162,―,有,平日9:00-14:00 17:30-19:00土9:00-12:00 木第2土休診,有
医療法人五常会 浅野クリニック,557-0042,大阪市西成区岸里東1丁目8番11号,06-6661-7129,http://gojou-asanocl.com/,有,月~金9:00-12:30 16:30-19:30,有
イワタ医院,557-0014,大阪市西成区天下茶屋2丁目23番5号,06-6661-8525,―,有,月~金9:30-11:30月火水金13:30-15:00火金18:00-20:00,有
くにしげレディースクリニック,557-0014,大阪市西成区天下茶屋3丁目18番16号グランドメゾン1階,06-6655-5855,http://kunishige-lc.com/,有,月火水金9:00-11:4516:00-18:00木土  9:00-11:45,有
くにしげレディースクリニック,557-0014,大阪市西成区天下茶屋3丁目18番16号グランドメゾン1階,06-6655-5855,http://kunishige-lc.com/,有,月火水金9:00-11:45 16:00-18:00水土9:00-11:45,有
医療法人竹村医学研究会(財団)小阪産病院,577-0807,大阪府東大阪市菱屋西3-6-8,06-6722-4771,https://www.kosaka.or.jp,有,日、祝日除く 8:30~16:30,有
市立東大阪医療センター,578-8588,大阪府東大阪市西岩田3-4-5,06-6781-5101,http://www.higashiosaka-mc.jp/,有,平日9:00~17:00,無
医療法人恵生会恵生会病院,579-8036,大阪府東大阪市鷹殿町20-29,072-982-5101,http://www.keiseikai.or.jp,有,24時間,有
笠原産婦人科医院,577-0007,大阪府東大阪市稲田本町3-18-23,06-6745-6204,http://www.eonet.ne.jp/~kasaharaclinic/,有,月・火・水・金9:30~12:30、17:00~19:00土9:00~12:00,有
基本情報,,,,,,,
施設名,郵便番号,住所,電話番号,ウェブサイトURL,産科、婦人科又は産婦人科の標榜の有無,医療機関における緊急避妊にかかる対面診療への対応可能時間帯,常時の緊急避妊薬の在庫の有無
かまちレディースクリニック,565-0855,大阪府吹田市佐竹台1丁目4-1クリニックモール南千里 201号,06-6170-9129,http://kamachi-ladies.com,有,月・火・木・金曜9:00-12:00、15:30-18:30水・土曜 9:00-12:00,有
医療法人玉樹会 玉田レディースクリニック,564-0018,大阪府吹田市岸部新町5-25健都メディカルビル2階,06-4860-6622,http://www.tamada-cl.com,有,月・火・金曜9:30-13:00、16:00-19:30木曜 16:00-19:30土曜 9:00-14:30,有
西田ヒロ子クリニック,564-0063,大阪府吹田市江坂町1丁目21-39-303土泰第一ビル3階,06-6380-1651,http://hiroko-clinic.jp,有,月~土曜 9:30-13:00月・火・木・金曜16:00-19:00,有
林田レディースクリニック,565-0874,大阪府吹田市吉江台4丁目2-60北千里医療ビル5階,06-4863-5773,ー,有,月・火・水・金曜9:30-12:00、14:00-17:00土曜 9:30-12:00,有
みさき医院,564-0011,大阪府吹田市岸部南2丁目1-6,06-6381-6022,ー,有,月・火・水・金曜9:00-12:00、17:00-19:00土曜 9:00-12:00,有
吉本婦人科クリニック,564-0082,大阪府吹田市片山町1丁目3-5シルバーマンションII2階,06-6337-0260,http://www.yoshimoto-clinic.net,有,平日 9:00-12:30、16:00-17:00土曜 9:00-13:00,有
医療法人 恵仁会 田中病院,567-0861,大阪府茨木市東奈良3-16-31,072-635-5831,info@tanaka-hsp.or.jp,有,平日 9:00から12:3017:30~19:30土曜 9:00~12:30,有
医療法人恒昭会 藍野病院,567-0011,大阪府大阪府茨木市高田町11番18号,072-627-7611,http://www.koshokai.or.jp/aino/,有,月(13:30~15:30)水( 9:00~12:00)金(13:30~15:30),有
医療法人和倉会 サンタマリア病院,567-0884,大阪府茨木市新庄町13-15,072-627-3459,st-main@santamaria-med.jp,有,月~土:9:00~12:00月・火・木・金:14:00~17:00,無
社会福祉法人恩賜財団大阪府支部大阪府済生会茨木病院,567-0035,大阪府茨木市見付山2-1-45,567-0035,https://www.ibaraki.saiseikai.or.jp/,有,平日 9:00~17:00土曜日 9:00~12:30(第三土曜日を除く),有
友紘会総合病院,567-0058,大阪府茨木市西豊川町25番1,072-641-2488,http://www.yukoukai.com/,有,平日:9:00~17:00土日祝:9:00~12:00,有
医療法人 大崎医院,567-0817,大阪府茨木市別院町7番33号,072-624-5087,www.osaki-clinic.net,有,"平日:9:00~12:30,17:00~19:30水・土:午前のみ",有
医療法人 加藤産婦人科クリニック,618-0014,大阪府三島郡島本町水無瀬1丁目14-13,075-962-3355,a-osan.com,有,緊急時は24時間,有
医療法人輝ジュンレディースクリニック千里丘,566-0001,大阪府摂津市千里丘2丁目15番16号,06-6330-3203,http://www.jun-lc.com,有,24時間,有
医療法人橘井会 江川産婦人科医院,567-0801,大阪府茨木市総持寺2丁目1番5号,072-625-3675,egawa-lc.net,有,月・水・金:9:00~12:00、17:00~19:30火・木・土:9:00~12:00,有
医療法人稲風会 鈴木医院,567-0888,大阪府茨木市駅前3丁目5番21号,072-624-1113,http://suzuki-clinic.fm,有,月~土:9:00~12:30火・木・土:13:00~14:45月・木・金:17:30~19:15,有
奥田産婦人科,567-0815,大阪府茨木市竹橋町15番8号,072-622-5253,www.okd-sanfujinka.com/index.html,有,平日:9:00~12:00、17:00~20:00,有
きどレディースクリニック,567-0828,大阪府茨木市舟木町15番6号,072-635-6366,―,有,月・火・木~土:9:00~12:30月・水・金:16:30~18:30火:15:00~17:30,有
